<?xml version="1.0" encoding="UTF-8"?>
<temporada xmlns:xsi="http://www.w3.org/2001/XMLSchema-instance"
    xsi:noNamespaceSchemaLocation="Ejercicio25.xsd" anio="2000">
    <jornada numero="1">
        <partido numero="1">
            <fecha>2002-02-02</fecha>
            <estadio espectadores="80000">La condomina</estadio>
            <local>RC Murcia</local>
            <visitante>Real Sociedad</visitante>
            <resultado local="3" vistante="2" />
        </partido>
        <partido numero="2">
            <fecha>2002-02-03</fecha>
            <estadio>Santiago Bernabeu</estadio>
            <local>Real Madrid</local>
            <visitante>Villareal</visitante>
            <aplazado />
        </partido>
        <partido numero="3">
            <fecha>2002-02-03</fecha>
            <estadio>Santiago Bernabeu</estadio>
            <local>Real Madrid</local>
            <visitante>Villareal</visitante>
            <aplazado />
        </partido>
    </jornada>
    <jornada numero="2">
        <!-- AquÃ­ datos de la Jornada 2 -->
    </jornada>
</temporada>